title,text,subject,date,label
"Trump says Russia probe will be fair, but timeline unclear: NYT","WEST PALM BEACH, Fla (Reuters) - President Donald Trump said on Thursday he believes he will be fairly treated in a special counsel investigation into Russian meddling in the U.S. presidential election, but said he did not know how long the probe would last. The federal investigation has hung over Trump’s White House since he took office almost a year ago, and some Trump allies have in recent weeks accused the team of Justice Department Special Counsel Robert Mueller of being biased against the Republican president. But in an interview with the New York Times, Trump appeared to shrug off concerns about the investigation, which was prompted by U.S. intelligence agencies’ conclusion that Russia tried to help Trump defeat Democrat Hillary Clinton by hacking and releasing embarrassing emails and disseminating propaganda. “There’s been no collusion. But I think he’s going to be fair,” Trump said in what the Times described as a 30-minute impromptu interview at his golf club in West Palm Beach, Florida. Mueller has charged four Trump associates in his investigation. Russia has denied interfering in the U.S. election. U.S. Deputy Attorney General Rod Rosenstein said this month that he was not aware of any impropriety by Mueller’s team. Trump’s lawyers have been saying for weeks that they had expected the Mueller investigation to wrap up quickly, possibly by the end of 2017. Mueller has not commented on how long it will last. Trump told the Times that he did not know how long the investigation would take. “Timing-wise, I can’t tell you. I just don’t know,” he said. Trump said he thought a prolonged probe “makes the country look bad” but said it has energized his core supporters. “What it’s done is, it’s really angered the base and made the base stronger. My base is strong than it’s ever been,” he said. The interview was a rare break in Trump’s Christmas vacation in Florida. He has golfed each day aside from Christmas Day, and mainly kept a low profile, apart from the occasional flurry of tweets. He spent one day golfing with Republican Senator David Perdue from Georgia, who has pushed legislation to cap immigration numbers, and had dinner on Thursday with Commerce Secretary Wilbur Ross, an international trade hawk. Trump told the Times he hoped to work with Democrats in the U.S. Congress on a spending plan to fix roads and other infrastructure, and on protections for a group of undocumented immigrants who were brought to the United States as children. Trump spoke about trade issues, saying he had backed off his hard line on Chinese trade practices in the hope that Beijing would do more to pressure North Korea to end its nuclear and missile testing program. He said he had been disappointed in the results. He also complained about the North American Free Trade Agreement (NAFTA), which his administration is attempting to renegotiate in talks with Mexico and Canada. Trump said Canadian Prime Minister Justin Trudeau had played down the importance of Canadian oil and lumber exports to the United States when looking at the balance of trade between the two countries. “If I don’t make the right deal, I’ll terminate NAFTA in two seconds. But we’re doing pretty good,” Trump said. ",politicsNews,"December 29, 2017 ",1
"Factbox: Trump on Twitter (Dec 29) - Approval rating, Amazon","The following statements were posted to the verified Twitter accounts of U.S. President Donald Trump, @realDonaldTrump and @POTUS.  The opinions expressed are his own. Reuters has not edited the statements or confirmed their accuracy.  @realDonaldTrump : - While the Fake News loves to talk about my so-called low approval rating, @foxandfriends just showed that my rating on Dec. 28, 2017, was approximately the same as President Obama on Dec. 28, 2009, which was 47%...and this despite massive negative Trump coverage & Russia hoax! [0746 EST] - Why is the United States Post Office, which is losing many billions of dollars a year, while charging Amazon and others so little to deliver their packages, making Amazon richer and the Post Office dumber and poorer? Should be charging MUCH MORE! [0804 EST] -- Source link: (bit.ly/2jBh4LU) (bit.ly/2jpEXYR) ",politicsNews,"December 29, 2017 ",1
Trump on Twitter (Dec 28) - Global Warming,"The following statements were posted to the verified Twitter accounts of U.S. President Donald Trump, @realDonaldTrump and @POTUS.  The opinions expressed are his own. Reuters has not edited the statements or confirmed their accuracy.  @realDonaldTrump : - Together, we are MAKING AMERICA GREAT AGAIN! bit.ly/2lnpKaq [1814 EST] - In the East, it could be the COLDEST New Year’s Eve on record. Perhaps we could use a little bit of that good old Global Warming that our Country, but not other countries, was going to pay TRILLIONS OF DOLLARS to protect against. Bundle up! [1901 EST] -- Source link: (bit.ly/2jBh4LU) (bit.ly/2jpEXYR) ",politicsNews,"December 29, 2017 ",1
Alabama official to certify Senator-elect Jones today despite challenge: CNN,"WASHINGTON (Reuters) - Alabama Secretary of State John Merrill said he will certify Democratic Senator-elect Doug Jones as winner on Thursday despite opponent Roy Moore’s challenge, in a phone call on CNN. Moore, a conservative who had faced allegations of groping teenage girls when he was in his 30s, filed a court challenge late on Wednesday to the outcome of a U.S. Senate election he unexpectedly lost. ",politicsNews,"December 28, 2017 ",1
Jones certified U.S. Senate winner despite Moore challenge,"(Reuters) - Alabama officials on Thursday certified Democrat Doug Jones the winner of the state’s U.S. Senate race, after a state judge denied a challenge by Republican Roy Moore, whose campaign was derailed by accusations of sexual misconduct with teenage girls. Jones won the vacant seat by about 22,000 votes, or 1.6 percentage points, election officials said. That made him the first Democrat in a quarter of a century to win a Senate seat in Alabama.  The seat was previously held by Republican Jeff Sessions, who was tapped by U.S. President Donald Trump as attorney general. A state canvassing board composed of Alabama Secretary of State John Merrill, Governor Kay Ivey and Attorney General Steve Marshall certified the election results. Seating Jones will narrow the Republican majority in the Senate to 51 of 100 seats. In a statement, Jones called his victory “a new chapter” and pledged to work with both parties. Moore declined to concede defeat even after Trump urged him to do so. He stood by claims of a fraudulent election in a statement released after the certification and said he had no regrets, media outlets reported. An Alabama judge denied Moore’s request to block certification of the results of the Dec. 12 election in a decision shortly before the canvassing board met. Moore’s challenge alleged there had been potential voter fraud that denied him a chance of victory. His filing on Wednesday in the Montgomery Circuit Court sought to halt the meeting scheduled to ratify Jones’ win on Thursday. Moore could ask for a recount, in addition to possible other court challenges, Merrill said in an interview with Fox News Channel. He would have to complete paperwork “within a timed period” and show he has the money for a challenge, Merrill said. “We’ve not been notified yet of their intention to do that,” Merrill said. Regarding the claim of voter fraud, Merrill told CNN that more than 100 cases had been reported. “We’ve adjudicated more than 60 of those. We will continue to do that,” he said.  Republican lawmakers in Washington had distanced themselves from Moore and called for him to drop out of the race after several women accused him of sexual assault or misconduct dating back to when they were teenagers and he was in his early 30s.  Moore has denied wrongdoing and Reuters has not been able to independently verify the allegations. ",politicsNews,"December 28, 2017 ",1
 Donald Trump Sends Out Embarrassing New Year’s Eve Message; This is Disturbing,"Donald Trump just couldn t wish all Americans a Happy New Year and leave it at that. Instead, he had to give a shout out to his enemies, haters and  the very dishonest fake news media.  The former reality show star had just one job to do and he couldn t do it. As our Country rapidly grows stronger and smarter, I want to wish all of my friends, supporters, enemies, haters, and even the very dishonest Fake News Media, a Happy and Healthy New Year,  President Angry Pants tweeted.  2018 will be a great year for America! As our Country rapidly grows stronger and smarter, I want to wish all of my friends, supporters, enemies, haters, and even the very dishonest Fake News Media, a Happy and Healthy New Year. 2018 will be a great year for America!  Donald J. Trump (@realDonaldTrump) December 31, 2017Trump s tweet went down about as welll as you d expect.What kind of president sends a New Year s greeting like this despicable, petty, infantile gibberish? Only Trump! His lack of decency won t even allow him to rise above the gutter long enough to wish the American citizens a happy new year!  Bishop Talbert Swan (@TalbertSwan) December 31, 2017no one likes you  Calvin (@calvinstowell) December 31, 2017Your impeachment would make 2018 a great year for America, but I ll also accept regaining control of Congress.  Miranda Yaver (@mirandayaver) December 31, 2017Do you hear yourself talk? When you have to include that many people that hate you you have to wonder? Why do the they all hate me?  Alan Sandoval (@AlanSandoval13) December 31, 2017Who uses the word Haters in a New Years wish??  Marlene (@marlene399) December 31, 2017You can t just say happy new year?  Koren pollitt (@Korencarpenter) December 31, 2017Here s Trump s New Year s Eve tweet from 2016.Happy New Year to all, including to my many enemies and those who have fought me and lost so badly they just don t know what to do. Love!  Donald J. Trump (@realDonaldTrump) December 31, 2016This is nothing new for Trump. He s been doing this for years.Trump has directed messages to his  enemies  and  haters  for New Year s, Easter, Thanksgiving, and the anniversary of 9/11. pic.twitter.com/4FPAe2KypA  Daniel Dale (@ddale8) December 31, 2017Trump s holiday tweets are clearly not presidential.How long did he work at Hallmark before becoming President?  Steven Goodine (@SGoodine) December 31, 2017He s always been like this . . . the only difference is that in the last few years, his filter has been breaking down.  Roy Schulze (@thbthttt) December 31, 2017Who, apart from a teenager uses the term haters?  Wendy (@WendyWhistles) December 31, 2017he s a fucking 5 year old  Who Knows (@rainyday80) December 31, 2017So, to all the people who voted for this a hole thinking he would change once he got into power, you were wrong! 70-year-old men don t change and now he s a year older.Photo by Andrew Burton/Getty Images.",News,"December 31, 2017",0
 Drunk Bragging Trump Staffer Started Russian Collusion Investigation,"House Intelligence Committee Chairman Devin Nunes is going to have a bad day. He s been under the assumption, like many of us, that the Christopher Steele-dossier was what prompted the Russia investigation so he s been lashing out at the Department of Justice and the FBI in order to protect Trump. As it happens, the dossier is not what started the investigation, according to documents obtained by the New York Times.Former Trump campaign adviser George Papadopoulos was drunk in a wine bar when he revealed knowledge of Russian opposition research on Hillary Clinton.On top of that, Papadopoulos wasn t just a covfefe boy for Trump, as his administration has alleged. He had a much larger role, but none so damning as being a drunken fool in a wine bar. Coffee boys  don t help to arrange a New York meeting between Trump and President Abdel Fattah el-Sisi of Egypt two months before the election. It was known before that the former aide set up meetings with world leaders for Trump, but team Trump ran with him being merely a coffee boy.In May 2016, Papadopoulos revealed to Australian diplomat Alexander Downer that Russian officials were shopping around possible dirt on then-Democratic presidential nominee Hillary Clinton. Exactly how much Mr. Papadopoulos said that night at the Kensington Wine Rooms with the Australian, Alexander Downer, is unclear,  the report states.  But two months later, when leaked Democratic emails began appearing online, Australian officials passed the information about Mr. Papadopoulos to their American counterparts, according to four current and former American and foreign officials with direct knowledge of the Australians  role. Papadopoulos pleaded guilty to lying to the F.B.I. and is now a cooperating witness with Special Counsel Robert Mueller s team.This isn t a presidency. It s a badly scripted reality TV show.Photo by Win McNamee/Getty Images.",News,"December 31, 2017",0
 Sheriff David Clarke Becomes An Internet Joke For Threatening To Poke People ‘In The Eye’,"On Friday, it was revealed that former Milwaukee Sheriff David Clarke, who was being considered for Homeland Security Secretary in Donald Trump s administration, has an email scandal of his own.In January, there was a brief run-in on a plane between Clarke and fellow passenger Dan Black, who he later had detained by the police for no reason whatsoever, except that maybe his feelings were hurt. Clarke messaged the police to stop Black after he deplaned, and now, a search warrant has been executed by the FBI to see the exchanges.Clarke is calling it fake news even though copies of the search warrant are on the Internet. I am UNINTIMIDATED by lib media attempts to smear and discredit me with their FAKE NEWS reports designed to silence me,  the former sheriff tweeted.  I will continue to poke them in the eye with a sharp stick and bitch slap these scum bags til they get it. I have been attacked by better people than them #MAGA I am UNINTIMIDATED by lib media attempts to smear and discredit me with their FAKE NEWS reports designed to silence me. I will continue to poke them in the eye with a sharp stick and bitch slap these scum bags til they get it. I have been attacked by better people than them #MAGA pic.twitter.com/XtZW5PdU2b  David A. Clarke, Jr. (@SheriffClarke) December 30, 2017He didn t stop there.BREAKING NEWS! When LYING LIB MEDIA makes up FAKE NEWS to smear me, the ANTIDOTE is go right at them. Punch them in the nose & MAKE THEM TASTE THEIR OWN BLOOD. Nothing gets a bully like LYING LIB MEDIA S attention better than to give them a taste of their own blood #neverbackdown pic.twitter.com/T2NY2psHCR  David A. Clarke, Jr. (@SheriffClarke) December 30, 2017The internet called him out.This is your local newspaper and that search warrant isn t fake, and just because the chose not to file charges at the time doesn t mean they won t! Especially if you continue to lie. Months after decision not to charge Clarke, email search warrant filed https://t.co/zcbyc4Wp5b  KeithLeBlanc (@KeithLeBlanc63) December 30, 2017I just hope the rest of the Village People aren t implicated.  Kirk Ketchum (@kirkketchum) December 30, 2017Slaw, baked potatoes, or French fries? pic.twitter.com/fWfXsZupxy  ALT- Immigration   (@ALT_uscis) December 30, 2017pic.twitter.com/ymsOBLjfxU  Pendulum Swinger (@PendulumSwngr) December 30, 2017you called your police friends to stand up for you when someone made fun of your hat  Chris Jackson (@ChrisCJackson) December 30, 2017Is it me, with this masterful pshop of your hat, which I seem to never tire of. I think it s the steely resolve in your one visible eye pic.twitter.com/dWr5k8ZEZV  Chris Mohney (@chrismohney) December 30, 2017Are you indicating with your fingers how many people died in your jail? I think you re a few fingers short, dipshit  Ike Barinholtz (@ikebarinholtz) December 30, 2017ROFL. Internet tough guy with fake flair. pic.twitter.com/ulCFddhkdy  KellMeCrazy (@Kel_MoonFace) December 30, 2017You re so edgy, buddy.  Mrs. SMH (@MRSSMH2) December 30, 2017Is his break over at Applebees?  Aaron (@feltrrr2) December 30, 2017Are you trying to earn your  still relevant  badge?  CircusRebel (@CircusDrew) December 30, 2017make sure to hydrate, drink lots of water. It s rumored that prisoners can be denied water by prison officials.  Robert Klinc (@RobertKlinc1) December 30, 2017Terrill Thomas, the 38-year-old black man who died of thirst in Clarke s Milwaukee County Jail cell this April, was a victim of homicide. We just thought we should point that out. It can t be repeated enough.Photo by Spencer Platt/Getty Images.",News,"December 30, 2017",0
 Trump Is So Obsessed He Even Has Obama’s Name Coded Into His Website (IMAGES),"On Christmas day, Donald Trump announced that he would  be back to work  the following day, but he is golfing for the fourth day in a row. The former reality show star blasted former President Barack Obama for playing golf and now Trump is on track to outpace the number of golf games his predecessor played.Updated my tracker of Trump s appearances at Trump properties.71 rounds of golf including today s. At this pace, he ll pass Obama s first-term total by July 24 next year. https://t.co/Fg7VacxRtJ pic.twitter.com/5gEMcjQTbH  Philip Bump (@pbump) December 29, 2017 That makes what a Washington Post reporter discovered on Trump s website really weird, but everything about this administration is bizarre AF. The coding contained a reference to Obama and golf:  Unlike Obama, we are working to fix the problem   and not on the golf course.  However, the coding wasn t done correctly.The website of Donald Trump, who has spent several days in a row at the golf course, is coded to serve up the following message in the event of an internal server error: https://t.co/zrWpyMXRcz pic.twitter.com/wiQSQNNzw0  Christopher Ingraham (@_cingraham) December 28, 2017That snippet of code appears to be on all https://t.co/dkhw0AlHB4 pages, which the footer says is paid for by the RNC? pic.twitter.com/oaZDT126B3  Christopher Ingraham (@_cingraham) December 28, 2017It s also all over https://t.co/ayBlGmk65Z. As others have noted in this thread, this is weird code and it s not clear it would ever actually display, but who knows.  Christopher Ingraham (@_cingraham) December 28, 2017After the coding was called out, the reference to Obama was deleted.UPDATE: The golf error message has been removed from the Trump and GOP websites. They also fixed the javascript  =  vs  ==  problem. Still not clear when these messages would actually display, since the actual 404 (and presumably 500) page displays a different message pic.twitter.com/Z7dmyQ5smy  Christopher Ingraham (@_cingraham) December 29, 2017That suggests someone at either RNC or the Trump admin is sensitive enough to Trump s golf problem to make this issue go away quickly once people noticed. You have no idea how much I d love to see the email exchange that led us here.  Christopher Ingraham (@_cingraham) December 29, 2017 The code was f-cked up.The best part about this is that they are using the  =  (assignment) operator which means that bit of code will never get run. If you look a few lines up  errorCode  will always be  404          (@tw1trsux) December 28, 2017trump s coders can t code. Nobody is surprised.  Tim Peterson (@timrpeterson) December 28, 2017Donald Trump is obsessed with Obama that his name was even in the coding of his website while he played golf again.Photo by Joe Raedle/Getty Images.",News,"December 29, 2017",0
 Pope Francis Just Called Out Donald Trump During His Christmas Speech,"Pope Francis used his annual Christmas Day message to rebuke Donald Trump without even mentioning his name. The Pope delivered his message just days after members of the United Nations condemned Trump s move to recognize Jerusalem as the capital of Israel. The Pontiff prayed on Monday for the  peaceful coexistence of two states within mutually agreed and internationally recognized borders. We see Jesus in the children of the Middle East who continue to suffer because of growing tensions between Israelis and Palestinians,  Francis said.  On this festive day, let us ask the Lord for peace for Jerusalem and for all the Holy Land. Let us pray that the will to resume dialogue may prevail between the parties and that a negotiated solution can finally be reached. The Pope went on to plead for acceptance of refugees who have been forced from their homes, and that is an issue Trump continues to fight against. Francis used Jesus for which there was  no place in the inn  as an analogy. Today, as the winds of war are blowing in our world and an outdated model of development continues to produce human, societal and environmental decline, Christmas invites us to focus on the sign of the Child and to recognize him in the faces of little children, especially those for whom, like Jesus,  there is no place in the inn,  he said. Jesus knows well the pain of not being welcomed and how hard it is not to have a place to lay one s head,  he added.  May our hearts not be closed as they were in the homes of Bethlehem. The Pope said that Mary and Joseph were immigrants who struggled to find a safe place to stay in Bethlehem. They had to leave their people, their home, and their land,  Francis said.  This was no comfortable or easy journey for a young couple about to have a child.   At heart, they were full of hope and expectation because of the child about to be born; yet their steps were weighed down by the uncertainties and dangers that attend those who have to leave their home behind. So many other footsteps are hidden in the footsteps of Joseph and Mary,  Francis said Sunday. We see the tracks of entire families forced to set out in our own day. We see the tracks of millions of persons who do not choose to go away, but driven from their land, leave behind their dear ones. Amen to that.Photo by Christopher Furlong/Getty Images.",News,"December 25, 2017",0
 Racist Alabama Cops Brutalize Black Boy While He Is In Handcuffs (GRAPHIC IMAGES),"The number of cases of cops brutalizing and killing people of color seems to see no end. Now, we have another case that needs to be shared far and wide. An Alabama woman by the name of Angela Williams shared a graphic photo of her son, lying in a hospital bed with a beaten and fractured face, on Facebook. It needs to be shared far and wide, because this is unacceptable.It is unclear why Williams  son was in police custody or what sort of altercation resulted in his arrest, but when you see the photo you will realize that these details matter not. Cops are not supposed to beat and brutalize those in their custody. In the post you are about to see, Ms. Williams expresses her hope that the cops had their body cameras on while they were beating her son, but I think we all know that there will be some kind of convenient  malfunction  to explain away the lack of existence of dash or body camera footage of what was clearly a brutal beating. Hell, it could even be described as attempted murder. Something tells me that this young man will never be the same. Without further ado, here is what Troy, Alabama s finest decided was appropriate treatment of Angela Williams  son:No matter what the perceived crime of this young man might be, this is completely unacceptable. The cops who did this need to rot in jail for a long, long time   but what you wanna bet they get a paid vacation while the force  investigates  itself, only to have the officers returned to duty posthaste?This, folks, is why we say BLACK LIVES MATTER. No way in hell would this have happened if Angela Williams  son had been white. Please share far and wide, and stay tuned to Addicting Info for further updates.Featured image via David McNew/Stringer/Getty Images",News,"December 25, 2017",0
