title,text,subject,date,label
" Fresh Off The Golf Course, Trump Lashes Out At FBI Deputy Director And James Comey","Donald Trump spent a good portion of his day at his golf club, marking the 84th day he s done so since taking the oath of office. It must have been a bad game because just after that, Trump lashed out at FBI Deputy Director Andrew McCabe on Twitter following a report saying McCabe plans to retire in a few months. The report follows McCabe s testimony in front of congressional committees this week, as well as mounting criticism from Republicans regarding the Russia probe.So, naturally, Trump attacked McCabe with a lie. How can FBI Deputy Director Andrew McCabe, the man in charge, along with leakin  James Comey, of the Phony Hillary Clinton investigation (including her 33,000 illegally deleted emails) be given $700,000 for wife s campaign by Clinton Puppets during investigation?  Trump tweeted.How can FBI Deputy Director Andrew McCabe, the man in charge, along with leakin  James Comey, of the Phony Hillary Clinton investigation (including her 33,000 illegally deleted emails) be given $700,000 for wife s campaign by Clinton Puppets during investigation?  Donald J. Trump (@realDonaldTrump) December 23, 2017He didn t stop there.FBI Deputy Director Andrew McCabe is racing the clock to retire with full benefits. 90 days to go?!!!  Donald J. Trump (@realDonaldTrump) December 23, 2017Wow,  FBI lawyer James Baker reassigned,  according to @FoxNews.  Donald J. Trump (@realDonaldTrump) December 23, 2017With all of the Intel at Trump s disposal, he s getting his information from Fox News. McCabe spent most of his career in the fight against terrorism and now he s being attacked by the so-called president. Trump has been fact-checked before on his claim of his wife receiving $700,000 for her campaign.Politifact noted in late July that Trump s  tweet about Andrew McCabe is a significant distortion of the facts. And the implication that McCabe got Clinton off as a political favor doesn t make much sense when we look at the evidence. His July tweet was rated  mostly false.  But Trump repeats these lies because he knows his supporters will believe them without bothering to Google. It s still a lie, though.Photo by Zach Gibson   Pool/Getty Images.",News,"December 23, 2017",0
" Trump Said Some INSANELY Racist Stuff Inside The Oval Office, And Witnesses Back It Up","In the wake of yet another court decision that derailed Donald Trump s plan to bar Muslims from entering the United States, the New York Times published a report on Saturday morning detailing the president s frustration at not getting his way   and how far back that frustration goes.According to the article, back in June, Trump stomped into the Oval Office, furious about the state of the travel ban, which he thought would be implemented and fully in place by then. Instead, he fumed, visas had already been issued to immigrants at such a rate that his  friends were calling to say he looked like a fool  after making his broad pronouncements.It was then that Trump began reading from a document that a top advisor, noted white supremacist Stephen Miller, had handed him just before the meeting with his Cabinet. The page listed how many visas had been issued this year, and included 2,500 from Afghanistan (a country not on the travel ban), 15,000 from Haiti (also not included), and 40,000 from Nigeria (sensing a pattern yet?), and Trump expressed his dismay at each.According to witnesses in the room who spoke to the Times on condition of anonymity, and who were interviewed along with three dozen others for the article, Trump called out each country for its faults as he read: Afghanistan was a  terrorist haven,  the people of Nigeria would  never go back to their huts once they saw the glory of America, and immigrants from Haiti  all have AIDS. Despite the extensive research done by the newspaper, the White House of course denies that any such language was used.But given Trump s racist history and his advisor Stephen Miller s blatant white nationalism, it would be no surprise if a Freedom of Information Act request turned up that the document in question had the statements printed inline as commentary for the president to punctuate his anger with. It was Miller, after all, who was responsible for the  American Carnage  speech that Trump delivered at his inauguration.This racist is a menace to America, and he doesn t represent anything that this country stands for. Let s hope that more indictments from Robert Mueller are on their way as we speak.Featured image via Chris Kleponis/Pool/Getty Images",News,"December 23, 2017",0
" Former CIA Director Slams Trump Over UN Bullying, Openly Suggests He’s Acting Like A Dictator (TWEET)","Many people have raised the alarm regarding the fact that Donald Trump is dangerously close to becoming an autocrat. The thing is, democracies become autocracies right under the people s noses, because they can often look like democracies in the beginning phases. This was explained by Republican David Frum just a couple of months into Donald Trump s presidency, in a piece in The Atlantic called  How to Build an Autocracy. In fact, if you really look critically at what is happening right now   the systematic discrediting of vital institutions such as the free press and the Federal Bureau of Investigation as well the direct weaponization of the Department of Justice in order to go after Trump s former political opponent, 2016 Democratic nominee Hillary Clinton, and you have the makings of an autocracy. We are more than well on our way. Further, one chamber of Congress, the House of Representatives, already has a rogue band of Republicans who are running a parallel investigation to the official Russian collusion investigation, with the explicit intent of undermining and discrediting the idea that Trump could have possibly done anything wrong with the Russians in order to swing the 2016 election in his favor.All of that is just for starters, too. Now, we have Trump making United Nations Ambassador Nikki Haley bully and threaten other countries in the United Nations who voted against Trump s decision to change U.S. policy when it comes to recognition of Jerusalem as the capital of the Jewish State. Well, one expert, who is usually quite measured, has had enough of Trump s autocratic antics: Former CIA Director John O. Brennan. The seasoned spy took to Trump s favorite platform, Twitter, and blasted the decision:Trump Admin threat to retaliate against nations that exercise sovereign right in UN to oppose US position on Jerusalem is beyond outrageous. Shows @realDonaldTrump expects blind loyalty and subservience from everyone qualities usually found in narcissistic, vengeful autocrats.  John O. Brennan (@JohnBrennan) December 21, 2017Director Brennan is correct, of course. Trump is behaving just like an autocrat, and so many people in the nation are asleep when it comes to this dangerous age, in which the greatest threat to democracy and the very fabric of the republic itself is the American president. Fellow Americans, we know the GOP-led Congress will not be the check on Trump that they are supposed to be. It s time to get out and flip the House and possibly the Senate in 2018, and resist in the meantime, if we want to save our country from devolving into something that looks more like Russia or North Korea than the America we have always know. We re already well on our way.Featured image via BRENDAN SMIALOWSKI/AFP/Getty Images",News,"December 22, 2017",0
 WATCH: Brand-New Pro-Trump Ad Features So Much A** Kissing It Will Make You Sick,"Just when you might have thought we d get a break from watching people kiss Donald Trump s ass and stroke his ego ad nauseam, a pro-Trump group creates an ad that s nothing but people doing even more of those exact things. America First Policies is set to release this ad, called  Thank You, President Trump,  on Christmas Day and, well, we threw up a little in our mouths trying to watch this.Basically, the spot is nothing but people fawning all over Trump for all the stuff he hasn t actually done. The ad includes a scene with a little girl thanking Trump for bringing back  Merry Christmas,  which never went away (there are even videos of President Obama saying  Merry Christmas  himself). A man thanks him for cutting his taxes. And America First says that everyday Americans everywhere are thanking Trump for being such a great and awesome president.The best president.Nobody s ever done what he s done. He s breaking all kinds of records every day.Believe us.Anyway, the word  propaganda  comes to mind when watching this. That s what it is   literal propaganda promoting someone who shouldn t need this kind of promotion anymore. Watch this ad bullshit below:The way the MAGAs are kowtowing to Orange Hitler is both disgusting and frightening. The man has done nothing, and his policies will harm the very same Americans who are thanking him. Unfortunately, it will take an obscene amount of pain before they ll open their eyes and see they ve been duped by a con man with a bad hairdo.And his ongoing need for this kind of adoration is, at best, unbecoming of his office. This ad is vile.Featured image via Al Drago-Pool/Getty Images",News,"December 21, 2017",0
" Papa John’s Founder Retires, Figures Out Racism Is Bad For Business","A centerpiece of Donald Trump s campaign, and now his presidency, has been his white supremacist ways. That is why so many of the public feuds he gets into involve people of color. One of his favorite targets, is, of course, the players in the National Football League who dare to exercise their First Amendment rights by kneeling during the national anthem in protest of racist police brutality. Well, there is one person who has figured out that racism is bad for business, even if it did get the orange overlord elected: The founder of the pizza chain Papa John s.This is a man who has never been on the right side of history on any number of issues, and plus his pizza sucks. But, when he decided to complain about the players protesting, his sales really dropped. Turns out racism doesn t pay, and we all know that corporations are all about the bottom line. Therefore, Papa John Schnatter will no longer be CEO of the hack pizza chain.BREAKING: Papa John's founder John Schnatter to step down as CEO; announcement comes weeks after he criticized NFL over protests.  AP Business News (@APBusiness) December 21, 2017The thing is, while people are certainly allowed to have political opinions, they have to realize that those opinions can often come with dire consequences   especially if one is in the business of trying to garner sales and support from any and all people, which one would presume is the goal of all CEO s. No one knows whether or not the pressure from his shareholders, the public outcry or boycotts, or even the NFL itself had anything to do with his stepping down. As of right now, all we know is that he will be gone, and perhaps the future CEO will run a company that is inclusive of the diverse fabric that we call America. After all, the guiding symbol of this nation will always be the Statue of Liberty, and bigots like Trump and Schnatter are the past. The rest of us are the future. We just have to survive the present to get there.Featured image via Rob Kim/Getty Images",News,"December 21, 2017",0
